{"apiVersion":"graphos.io/v1","catalogVersion":1,"entries":[{"executor":"epistemic-graph-authority.hydrate-engine-embeddings","fromState":"node-property-embeddings","migrationId":"embedding-authority-ann-v1","mode":"one-time-persisted-state","postconditions":["all-eligible-embeddings-indexed","hydration-count-reconciled","semantic-query-smoke-pass"],"preconditions":["signed-pre-cutover-snapshot","exact-release-engine-ready","exclusive-migration-lease"],"rollback":"restore-signed-pre-cutover-snapshot","toState":"authority-ann-index","version":"1"}],"entryCount":1,"kind":"IndexMigrationCatalog","migrationMode":"one-time-persisted-state"}
